{
  "$schema": "https://json-schema.org/draft/2020-12/schema",
  "type": "object",
  "properties": {
    "name": {
      "type": "string"
    },
    "corporate_body": {
      "type": "boolean"
    },
    "fictional": {
      "type": "boolean"
    },
    "uri": {
      "type": "string"
    },
    "biographical_data": {
      "type": "string"
    },
    "profession": {
      "type": "string"
    },
    "pseudonyms": {
      "type": "string"
    },
    "refs": {
      "type": "string"
    },
    "data": {},
    "created": {
      "type": "string"
    },
    "updated": {
      "type": "string"
    },
    "musenalm_id": {
      "type": "number"
    },
    "edit_state": {
      "type": "string"
    },
    "annotation": {
      "type": "string"
    },
    "edit_comment": {
      "type": "string"
    },
    "editor": {
      "type": "string"
    }
  },
  "required": [
    "name",
    "musenalm_id"
  ],
  "additionalProperties": false
}
