{
  "annotation": "",
  "biographical_data": "",
  "corporate_body": true,
  "created": "2026-06-11 10:17:36.522Z",
  "data": null,
  "edit_comment": "",
  "edit_state": "Edited",
  "fictional": false,
  "musenalm_id": 3253,
  "name": "Arnold u. Pinther",
  "profession": "",
  "pseudonyms": "",
  "refs": "",
  "updated": "2026-06-11 10:17:36.522Z",
  "uri": "",
  "editor": ""
}
