{
  "annotation": "",
  "biographical_data": "1776-1852",
  "corporate_body": false,
  "created": "2026-06-11 10:17:36.448Z",
  "data": {
    "gnd": {
      "@context": "https://lobid.org/gnd/context.jsonld",
      "dateOfBirth": [
        "1776"
      ],
      "dateOfDeath": [
        "1852-06-12"
      ],
      "describedBy": {
        "dateModified": "2020-05-08T07:58:50.000",
        "dctCreator": {
          "id": "https://ld.zdb-services.de/resource/organisations/DE-14",
          "label": "https://ld.zdb-services.de/resource/organisations/DE-14"
        },
        "descriptionLevel": {
          "id": "https://d-nb.info/standards/vocab/gnd/description-level#3",
          "label": "Katalogisierungslevel 3"
        },
        "id": "https://d-nb.info/gnd/1017962820/about",
        "license": {
          "id": "http://creativecommons.org/publicdomain/zero/1.0/",
          "label": "http://creativecommons.org/publicdomain/zero/1.0/"
        },
        "maintainer": {
          "id": "https://ld.zdb-services.de/resource/organisations/DE-576",
          "label": "https://ld.zdb-services.de/resource/organisations/DE-576"
        }
      },
      "gender": [
        {
          "id": "https://d-nb.info/standards/vocab/gnd/gender#male",
          "label": "Männlich"
        }
      ],
      "geographicAreaCode": [
        {
          "id": "https://d-nb.info/standards/vocab/gnd/geographic-area-code#ZZ",
          "label": "Land unbekannt"
        }
      ],
      "gndIdentifier": "1017962820",
      "id": "https://d-nb.info/gnd/1017962820",
      "oldAuthorityNumber": [
        "(DE-588a)1017962820"
      ],
      "placeOfBirthAsLiteral": [
        "Liska bei Holič"
      ],
      "placeOfDeath": [
        {
          "id": "https://d-nb.info/gnd/4076310-9",
          "label": "Prag"
        }
      ],
      "preferredName": "Pucherna, Antonin",
      "preferredNameEntityForThePerson": {
        "forename": [
          "Antonin"
        ],
        "surname": [
          "Pucherna"
        ]
      },
      "relatedConferenceOrEvent": [
        {
          "id": "https://d-nb.info/gnd/1054636-4",
          "label": "Consultation Meeting on the Iron and Steel Industry"
        }
      ],
      "sameAs": [
        {
          "collection": {
            "abbr": "VIAF",
            "icon": "http://viaf.org/viaf/images/viaf.ico",
            "id": "http://www.wikidata.org/entity/Q54919",
            "name": "Virtual International Authority File (VIAF)",
            "publisher": "OCLC"
          },
          "id": "http://viaf.org/viaf/83875200"
        },
        {
          "collection": {
            "abbr": "WIKIDATA",
            "icon": "https://www.wikidata.org/static/favicon/wikidata.ico",
            "id": "http://www.wikidata.org/entity/Q2013",
            "name": "Wikidata",
            "publisher": "Wikimedia Foundation Inc."
          },
          "id": "http://www.wikidata.org/entity/Q20851125"
        },
        {
          "collection": {
            "abbr": "DNB",
            "icon": "https://www.dnb.de/SiteGlobals/Frontend/DNBWeb/Images/favicon.png?__blob=normal&v=4",
            "id": "http://www.wikidata.org/entity/Q36578",
            "name": "Gemeinsame Normdatei (GND) im Katalog der Deutschen Nationalbibliothek",
            "publisher": "Deutsche Nationalbibliothek"
          },
          "id": "https://d-nb.info/gnd/1017962820/about"
        },
        {
          "collection": {
            "id": "https://isni.org"
          },
          "id": "https://isni.org/isni/0000000067092115"
        },
        {
          "collection": {
            "abbr": "OEBL",
            "id": "https://www.biographien.ac.at",
            "name": "Österreichisches Biographisches Lexikon",
            "publisher": "Österreichische Akademie der Wissenschaften"
          },
          "id": "https://www.biographien.ac.at/oebl/oebl_P/Pucherna_Antonin_1776_1852.xml?frames=yes"
        }
      ],
      "type": [
        "AuthorityResource",
        "DifferentiatedPerson",
        "Person"
      ]
    },
    "gnd_candidate_count": 1,
    "gnd_match_strategy": "exact_years_preferred_name",
    "gnd_matched_at": "2026-06-11T12:32:42Z",
    "gnd_query_biographical_data": "1776-1852",
    "gnd_query_name": "pucherna, antonin"
  },
  "edit_comment": "",
  "edit_state": "Edited",
  "fictional": false,
  "musenalm_id": 2139,
  "name": "Pucherna, Antonin",
  "profession": "Graphik",
  "pseudonyms": "",
  "refs": "T/B XXVII, 443",
  "updated": "2026-06-11 13:29:24.134Z",
  "uri": "https://d-nb.info/gnd/1017962820",
  "editor": ""
}
